reviewer,rating,written_date,title,review_text,branch
Heather J,2.0," May 8, 2021",Family vacay,"We were disappointed because as a family of 12, 4 were under the age of 11 and unable to ride most things. We paid $145/ticket for each person, the kids area was closed down, there was a pretty severe storm that rolled through (no fault of the park obviously) and that shut down several things also. You have to buy multi day hopper pass because you can't purchase a single day, multi park ticket and thats $292 for 2 adults! Apparently we didn't research enough to know that the majority of the rides we were looking forward to, were in the Island of Adventure park, and we couldn't access them. We walked the entire park in a fairly short amount of time and half our group went back to the hotel because there was nothing for the little people to do after about 2.5 hours. The other half stayed longer to ride a few things and even at half capacity, we still had to wait 60 minutes for the Harry Potter ride which was cool, but short and not worth the wait. I couldn't imagine waiting hours for it! As typical, food was crazy expensive and just ehhh, ok, parking $26.... There was no sanitization available at the drink refill stations and everyone just kept touching the same surfaces and I never saw anyone wiping them down. We were so excited for this visit and were incredibly disappointed in our first experience.",Universal Studios Florida
Jewel G,1.0," May 8, 2021",Reality TV theme park style,"On day one we were seriously aware that no one was enforcing the cleaning, masking or distancing restrictions. The staff at the stores in CityWalk were rude and not accommodating. The parks were ok during the week but its dirty with long chaotic lines. The only reason to go is to see Harry Potter in my opinion. My suggestion is go during the week and go early otherwise you will be packed in with hundreds of others in the heat without proper restrictions. We stayed in the last day to watch the reality tv show that was occurring hourly between patrons and staff by the pool at the hotel. Save your money and go to Disney.",Universal Studios Florida
Sarah L,5.0," May 7, 2021",Loved it,"Our family did both parks in two days during COVID, with a park hopper. We intentionally chose this time to go in the hopes of lower crowds due to reduced capacity limits. We also picked the first week of May for the same reason - hoping for slightly lower crowds.  It was our first time to Universal theme parks, and we had a great time. My kids are probably unusually adventurous and hardy (as a friend of our says, they are like little Vikings), so at 11 and 6 they both had a blast here, and found it a little more exciting than Disney (“less boring” as my 6 year old said). We did opt for the unlimited Express-pass, and we were not sure it was worth it. This could be due to the reduced capacity. Which I will say I can’t imagine these parks with 50% more people in them. I would never come here during peak season, as the parks themselves are more compact than Disney. We had the ability to child-swap with the family we came with, so all of us were able to ride most of the rides twice. So by the second day, we didn’t really want to ride anything again, which made the unlimited pass seem unnecessary. I wouldn’t come here without at least the one time express pass though, because in two days we did everything! Overall, we found the food situation a bit difficult to navigate, but I feel like once you get to know it, it made more sense. It was hard to just find food when you were hungry without excessive waits. The mobile ordering was not really intuitive, and we couldn’t get my account working to try it anyway.  Here’s what we loved about US. Diagon Ally is amazing, and we spent quite a bit of time here. There are more 3D-4D rides on this side, and we really enjoyed them, although not everyone in our party was as interested. My daughters loved the Simpsons ride and it’s pretty funny. In fact one of the things we enjoyed about Universal, was a lot of laughs, wit, humor and the sense of immersion in the movie.  Drawbacks were few, the main one being the Wand Experience, which is a hyped up sales pitch. A tip is get there during early admission if you can the first day and sign up it, then purchase the wand. After the experience we didn’t have the heart to say no to them, and ended up buying two more wands. The other disappointing thing was they only chose our oldest daughter for the show. Luckily I asked about it as they ushered us out (as I didn’t that understand going into it), and they nicely called us back in. They did a truncated version of the show for my little one, but she rolled with it. My youngest always seems to get the short end of the stick, so I was initially mortified by this, as she just wilted as we were walking out. My tip would be to let the wand master know that both kids need a wand (they did both the kids for the family we were traveling with) or ask about booking different times.",Universal Studios Florida
amway60436,3.0," May 6, 2021",Ok...,"First off most of the information given to me by Guest Services over the phone was inaccurate. The dining plan is only good within the parks according to a staff member at our resort and the refillable cups are only good in the parks as well. The freestyle cup has to be activated daily which is a major inconvenience since you have to wait in long lines just to activate a cup then go look for a station to fill it at. A staff member at our resort actually told us even though 1 of the restaurants within the resort is listed as quick service facility they don't accept the dining card and when I mentioned it to a staff member at the park she seemed surprised and said ""I guess I learned something today."" The 2 park per day ticket is only good for the theme parks which I had been told it applied to all 3 parks. If you want to go to Volcano Bay you have to purchase the 3 park ticket. The photo package was a total waste of money. Only a few rides take pics and I only saw 1 person in front of the theme park taking pics which I never got since she told me she couldn't scan my photo pass she had to give me a different card each time and I wasn't able to download them. Maybe we are a little spoiled by Disney since everything is extremely convenient with them. Everything with Universal is unorganized and wastes a ton of time. If they made everything accessible through the app it would be so much easier. The only thing good about Universal is they keep the ride lines moving and the wait is not that long at all but summertime may be different.",Universal Studios Florida
Coastal299113,1.0," May 6, 2021",good time at City Walk and Portofino hotel,"We were a group of 3 older women with canes that love Harry Potter. The attendants on the rides were great, but some other workers - such as the wicked wizards at Olivetti's wands were just plain rude. They refused to answer questions just said 'we had to have a tablet' and to 'go away' . We found a more personable wizard the next day and he explained that we had to be there very early (and we had early admission and got there asap) and did not give us much hope. We did not want to come back at 5 in hopes of a cancellation. High heat , masks, old women and wicked wizards just do not work. We stayed in park just in the mornings and did not come back the 3rd day. Stay away",Universal Studios Florida
Kathy E,3.0," May 6, 2021",Universal - too hot for masks,"My husband and I visited Universal a couple years ago and had a fantastic time. This trip didn’t meet those expectations. The rides IF/WHEN you got to them met our expectations. Several were closed for most of the day. Temps hit 95 all days we were there. You were forced to wear a mask all the time except when you were “actively eating or drinking in a stationary spot.” The Express Passes ruined our visit. I get it the Express People paid extra, but there needs to be limits to give the Gen Pop a fair chance at the rides. A 25 min wait at the train turned into a 70 min wait in the hot dungeon with our faces covered. People were dropping from the heat.  Places to eat and drink experiences long, slow, never-ending lines of people waiting in the sun. Since our last visit, Universal has added two huge hotels and two new, modern rollercoasters, but no new places to get food and drink. The park has limited infrastructure and the visitors needs need to be addressed too.  We stayed at Endless Summer hotel which was very nice, but the lobby stayed warm due to all the people. (It was only 1/2 full too.) Pier 8 offered some reasonably priced food items. Some items we wish we could have used, but we had no microwave in our room. :.( Staff members were friendly and courteous. We also had to buy coffee in the park since we don’t drink Starbucks and we also didn’t have a coffee maker in our room.  We chose this time because school was still in session. Ha! Can you say “virtual learning!” We cut our vacation short by a day. Between the heat, masks, and crowds, we’d had enough.",Universal Studios Florida
Erica C,1.0," May 6, 2021",Terrible. DANGEROUS.,"I’m in Universal Studios right now standing in an outside line. It’s 90 degrees here. The wait is 70 minutes long and they just broadcasted an announcement that “for everyone’s safety no eating or drinking is permitted while in line. Please keep your face covering over your mouth and nose at all times.” Meanwhile we are standing in the sun, dripping in sweat, and the lines are “socially distanced”.",Universal Studios Florida
Krosener314,3.0," May 5, 2021",fon times long food cart lines,"we had the dining pass but the wait times were ridiculous. The park itself was great, The lines were not awful until after 2pm",Universal Studios Florida
LivingTheDream,1.0," May 4, 2021",Save the respiratory distress and money,"✅ $850💵 + ⏰ hours of high heat 91 degrees🔥 & 😷☀️. We were shocked to be in long lines walking about 7.5 miles for the day masked up! Like sheep 🐑 being threatened constantly with loud speaker 🔈announcements demanding no drinking 🥤or eating while walking 🚶‍♀️& maintain social distancing, wearing a mask at all times or being 👢booted from the park. I saw kids 👆touching all handrails and then putting hands in their parents cups eating ice and then the parents gulping down the remainder(at $10 per beverage can you blame them) 🤷‍♂️ confused I do thousands of people show up to spend 💰💰💰💰💰💰if they are paranoid of public places! Universal Studios is a germs 🦠 paradise! They also pray on people’s wallets with the nifty reservation system it allows them to supply and demand fast passes from $80 extra to $249 demanding on all the variables they control! We despised being ordered around with lousy customer service! Constant loud interruptions🛑 during the rides 🎢demanding guests wear a mask 😷! Save yourself the 💰money, headaches 💊 and don’t go!! It’s ridiculous hypocrisy! Stay home save yourself the money and respiratory distress wearing a mask in 91 degree weather! Big brother is 👀watching!",Universal Studios Florida
TBarbette,1.0," May 4, 2021",Vacations Packages are a scam!,"I've been waiting multiple DAYS on the phone to modify my vacation package (I do have the paid Cancellation option, but we did not even get that far...).  And of course any change cannot be done online. I can only advise people to stay far from the vacation packages! Find a tour operator or buy tickets separately. Or do so if you are sure you don't need to change anything. I guess in covid times nobody can say that though. You would have to go anyway and spread the virus, or loose thousands of $... For sure they won't allow to reimburse a-posteriori as it's a 7 days prior limit in the conditions.  Not even sure I want to go anymore now...",Universal Studios Florida
Ilaria T,4.0," May 3, 2021","Awesome experience, with a couple tips...","We totally loved our experience at Universal mid April, with two kids 10 and 6. I have a few important tips: -100% buy the express pass, it's totally worth it. Without it, no way to enjoy all the rides even during a weekday; -bring snacks/food and water bottles. We had a stroller even if my daughter is way too old to use it on a daily basis, but it was awesome to be able to carry stuff all over the park. We didn't have to wait in line for food as we packed sandwiches and snacks; - skip the shops and buy souvenirs outside the park if you want to save money and wait lines; - skip the VIP parking; -wr hated the Virtual line system for the Hagrid ride. We couldn't get on despite trying for two days. They should just allow standby lines in addition to virtual lines to avoid so many frustrated people clicking insanely on their phones; -skip the Pterodactyl ride if the line is more than 20 minutes. It's so short it's not worth it; -must do for us: HP escape from Gringotts, HP journey, Transformers 3D, The Mummy, Jurassic river adventure, Hulk rollercoaster, Tycoon Lagoon... All in all, it was amazing and I would definitely do it again!",Universal Studios Florida
Betty A,2.0," May 1, 2021",Disappointed,"This was our 3rd and by far worst experience at Universal. We had a park to park pass and only rode a total of 6 rides due to long wait times and shortened hours . We stayed on Universal Property which was wonderful with the exception of over priced food options. Anyway, even with early park entry it was very disappointing. We did look into fast passes and found out they were far too expensive (@$240 per person) which is way out of budget after paying the park to park admission. Lines were long the park was over crowded and people were not observing social distancing. We tried getting reservations same day at the restaurants on city walk and they were booked 3 days out .",Universal Studios Florida
Julie B,5.0," May 1, 2021",Good when no talking,We enjoyed the rides and attractions! The food was good! Many friends go here! The employees are rude! Never changed! Casey said she worked here! Thank you!,Universal Studios Florida
Karen B,2.0," April 30, 2021",Not worth it,"I don't understand the hype at all. Harry Potter Diagon Alley was the only good thing about this place but even at that it was incredibly overcrowded and we couldn't even experience any rides or shows. And the Dragon on Grigott's was not able to breathe the fire! The people working there said they didn't know why it wasn't working. Everything else in the park is outdated and irrelevant. Long lines, too crowded, not much to do, overpriced. Just a lot of stores to buy overpriced commercialized products. the one rollercoaster my daughter wanted to go on got closed down after she waited over an hour in line. And at some point during the day my other daughter's HP wand was stolen out of our bag that we had been carrying all day. It was never one placed down. We will NEVER return to this trap.",Universal Studios Florida
Mike M,1.0," April 29, 2021",A complete waste,Absolutely complete waste of money! Have a disabled child and the whole family got attitude and we were treated like garbage. Waited in hour in line because 2 people were working the line for a disability pass. Got the pass after several weird questions on her disability. The pass is useless once you pick a ride you wait for your time to return. In the meantime you can not go on another ride. So what do you do for an hour with a disabled child. Disney has no issues with there system. The food service is even worse recieved 2 burgers with hair in it. Didn't get our drinks till 20mins after we received the food. We and several other families were told with an attitude that they are behind on drinks! You expect me to believe it's harder to pour soda then make a burger. For 400$ we got to go on 2rides. Complete waste of 8hrs and 400 hundred dollars. STICK WITH DISNEY!!!,Universal Studios Florida
Tara W,5.0," April 28, 2021",Awesome Guest Service help,"I really needed to leave a review, we haven't been yet but planning is part of all the work. I did have trouble with the website and trying to get anyone on the phone at guest services. But we finally booked our trip on the website and decided a few days later to add a few things . When I called this time there was only a five minute wait. I had the pleasure of speaking to Sharon, she was not only helpful but she gave me tips, advice and was so pleasant. Sharon was so personable and a breath of fresh air. She helped me so much and I am so looking forward to this trip. I really wanted to do the survey after we spoke but we were disconnected. So here's my survey, Thank you Sharon.",Universal Studios Florida
Casey H,1.0," April 28, 2021",Not worth the stress or the money. Go to Disney instead.,"TLDR; They don’t observe or enforce Covid safety precautions and the limited park hours and long wait times make the trip a waste of time and money.  We went on April 26th and as soon as we walked up to the entrance, it was chaos. I wish I had taken a photo because I hadn’t seen a crowd like this since before Covid. I was shoulder to shoulder with unmasked strangers and did not see a single Universal employee in sight until we were at the main entrance to City Walk getting our temperature checked. At that point, the poor women checking temperatures were screaming at people to form a line. Everything in me was telling me to turn around and just ask for a refund, but I hoped it would get better once we got into the park.  Trying to get into the park wasn’t any easier, there were no guides to show us where to go and things were extremely backed up.  Once in the park, we figured we’d wait until wait times for Harry Potter rides went down and decided to ride some of the rides closer to the front of the park. The first line we get into was stress-inducing and made me want to leave right away. We begged people to observe the markings on the ground and keep a safe distance from us, but it wasn’t happening. People were taking their masks off in line when Universal employees were out of site (which I rarely even saw employees anyway) and even eating in line. We were unable to distance from the people in the lines to the left and right of where we stood and much preferred Disney’s plexiglass shields in these situations to Universals lack of dividers. It was loud (even for a musician that is hard of hearing) and the people in line with us were obnoxious and rude.  The whole reason we came to Universal was for Wizarding World of Harry Potter, but wait times were always over 75 minutes (or higher) and the Harry Potter parts of the park were always over crowded that we decided to keep our distance. It’s obvious they weren’t limited capacity. Everywhere we went, we were dodging people and trying to distance ourselves from others with no luck or reciprocated efforts.  After riding ONE Harry Potter ride (and not even the one we wanted to ride), we ended our day early and literally ran to the car to get out as fast as we could. Our experience was not worth the money for the ticket or the stress we endured throughout the park.  Honestly, we were shocked. Our experiences at the Disney parks were incredible as the staff went above and beyond to make sure Covid safety precautions were being followed and enforced. We never felt uncomfortable and rode every ride we wanted in every park with wait times under 45 minutes.",Universal Studios Florida
Pete O,1.0," April 26, 2021",Fast and Furious Supercharged,"This ride sucked. Completely lame. Over in about 2 mins. I get it, we were on a bus, not much you can do with it but the Kong ride is similar and 100% better. Do not waste your time even with a fast pass. And Vin Diesel is a horrible actor. :)",Universal Studios Florida
